[
  {
    "schema": "trusted-govuk-discovery.evidence-receipt.v1",
    "id": "trusted-govuk-discovery:evidence-receipt:sha256:22b647332ff9d7721c3f7abad143bdbf96ce0a16f4dd44281aa8c08c7d443617",
    "observedAt": "2026-08-29T14:55:00Z",
    "sourceLock": "curated-official-api-data-2026-08-29",
    "source": {
      "url": "https://developer.service.hmrc.gov.uk/api-documentation",
      "title": "HMRC Developer Hub",
      "publisher": "HM Revenue & Customs",
      "sourceDigest": "185642452e2bb89f24f35ef8c74b024c3f17841c07008d2ecda951292b5123e8"
    },
    "output": {
      "recordId": "govuk-discovery:api-documentation:hmrc",
      "recordDigest": "22b647332ff9d7721c3f7abad143bdbf96ce0a16f4dd44281aa8c08c7d443617",
      "bundleDigest": "20593105f6e34d5072f566b4f7b98cab143c4333c56bbabfca831b935237945c"
    },
    "assertionStatuses": [
      "normalised",
      "official-source"
    ],
    "limitations": [
      "This is a documentation-hub record, not one executable API contract.",
      "Authentication and authorisation vary by API and this record grants neither.",
      "A record-level licence was not established from the admitted sources."
    ],
    "boundaries": {
      "sourceWasNotRefetchedAtRuntime": true,
      "cryptographicSignatureVerified": false,
      "accessAuthorityGranted": false
    },
    "receiptDigest": "18c750043c1d3f965252ef0cb760d8639833bc0e98d41e5577eef4e4fe233308"
  },
  {
    "schema": "trusted-govuk-discovery.evidence-receipt.v1",
    "id": "trusted-govuk-discovery:evidence-receipt:sha256:6eecfc8fb6e1be78f28d16775c88beac86adfd84ee457499c8cf792de704ec42",
    "observedAt": "2026-08-29T14:55:00Z",
    "sourceLock": "curated-official-api-data-2026-08-29",
    "source": {
      "url": "https://www.api.gov.uk/gds/bank-holidays/",
      "title": "Bank Holidays — API Catalogue",
      "publisher": "Data Standards Authority",
      "sourceDigest": "38a3005396d328fb4d271d51cfd529579cfac6379de2c0a3bcfbf2ea09779b0c"
    },
    "output": {
      "recordId": "govuk-discovery:api:bank-holidays",
      "recordDigest": "6eecfc8fb6e1be78f28d16775c88beac86adfd84ee457499c8cf792de704ec42",
      "bundleDigest": "20593105f6e34d5072f566b4f7b98cab143c4333c56bbabfca831b935237945c"
    },
    "assertionStatuses": [
      "normalised",
      "official-source"
    ],
    "limitations": [
      "A record-level licence was not established from the admitted source.",
      "Dates may change and consumers should inspect the authoritative source.",
      "No runtime endpoint call is made by this prototype."
    ],
    "boundaries": {
      "sourceWasNotRefetchedAtRuntime": true,
      "cryptographicSignatureVerified": false,
      "accessAuthorityGranted": false
    },
    "receiptDigest": "0c13ce8c7ef391e8e0e01a699e6610e4e91eb0f016649c3002f0e68892cd4b68"
  },
  {
    "schema": "trusted-govuk-discovery.evidence-receipt.v1",
    "id": "trusted-govuk-discovery:evidence-receipt:sha256:8e0506f72b653ddde78a709af34ff344446f6c9d217a490c53429a1de6e52058",
    "observedAt": "2026-08-29T14:55:00Z",
    "sourceLock": "curated-official-api-data-2026-08-29",
    "source": {
      "url": "https://www.api.gov.uk/ch/companies-house/",
      "title": "Companies House — API Catalogue",
      "publisher": "Data Standards Authority",
      "sourceDigest": "ad64d2f0190aca7a43bda146d220f1e8a313ae4c8fca4b7030816578944ae606"
    },
    "output": {
      "recordId": "govuk-discovery:api:companies-house",
      "recordDigest": "8e0506f72b653ddde78a709af34ff344446f6c9d217a490c53429a1de6e52058",
      "bundleDigest": "20593105f6e34d5072f566b4f7b98cab143c4333c56bbabfca831b935237945c"
    },
    "assertionStatuses": [
      "official-source"
    ],
    "limitations": [
      "Authentication is required and this record grants no credentials or authority.",
      "A record-level licence was not established from the admitted sources.",
      "The prototype does not call the endpoint."
    ],
    "boundaries": {
      "sourceWasNotRefetchedAtRuntime": true,
      "cryptographicSignatureVerified": false,
      "accessAuthorityGranted": false
    },
    "receiptDigest": "a524ec0e132039263a8dd8286fb1383428a1329b50540f3036f8df8f47a6190b"
  },
  {
    "schema": "trusted-govuk-discovery.evidence-receipt.v1",
    "id": "trusted-govuk-discovery:evidence-receipt:sha256:a9c14b467fb9acd5b1796ebbfea205f88098c2a6839dcd39cdb0054f9e554849",
    "observedAt": "2026-08-29T14:55:00Z",
    "sourceLock": "curated-official-api-data-2026-08-29",
    "source": {
      "url": "https://www.api.gov.uk/ea/flood-monitoring/",
      "title": "Flood-monitoring — API Catalogue",
      "publisher": "Data Standards Authority",
      "sourceDigest": "58636db793a5c977bda1039b722faee903a082d83c34ae31f6806f2af8f2f380"
    },
    "output": {
      "recordId": "govuk-discovery:api:flood-monitoring",
      "recordDigest": "a9c14b467fb9acd5b1796ebbfea205f88098c2a6839dcd39cdb0054f9e554849",
      "bundleDigest": "20593105f6e34d5072f566b4f7b98cab143c4333c56bbabfca831b935237945c"
    },
    "assertionStatuses": [
      "official-source"
    ],
    "limitations": [
      "The API is beta and near real-time data may be delayed.",
      "The stated attribution must be retained when data is reused.",
      "This prototype does not call the endpoint."
    ],
    "boundaries": {
      "sourceWasNotRefetchedAtRuntime": true,
      "cryptographicSignatureVerified": false,
      "accessAuthorityGranted": false
    },
    "receiptDigest": "faa4c0c49311bbe2d1f2668f5329bf84b0c36a2c64954ff79f6ea8f765179fe2"
  },
  {
    "schema": "trusted-govuk-discovery.evidence-receipt.v1",
    "id": "trusted-govuk-discovery:evidence-receipt:sha256:7ac0ff09aca291a29af815e423458e3fbc0376a9e21e970c45be9c5d23f70672",
    "observedAt": "2026-08-29T14:55:00Z",
    "sourceLock": "curated-official-api-data-2026-08-29",
    "source": {
      "url": "https://www.api.gov.uk/gds/gov-uk-content/",
      "title": "GOV.UK Content — API Catalogue",
      "publisher": "Data Standards Authority",
      "sourceDigest": "0110ed23e4a62d31bebffd0ff2936e5cc47ca31d0f35a03304cf1ee6d08225a5"
    },
    "output": {
      "recordId": "govuk-discovery:api:govuk-content",
      "recordDigest": "7ac0ff09aca291a29af815e423458e3fbc0376a9e21e970c45be9c5d23f70672",
      "bundleDigest": "20593105f6e34d5072f566b4f7b98cab143c4333c56bbabfca831b935237945c"
    },
    "assertionStatuses": [
      "inferred",
      "normalised",
      "official-source"
    ],
    "limitations": [
      "The API is beta and does not cover every GOV.UK page or dynamic service.",
      "Linked attachments and third-party material may have different rights.",
      "This catalogue record does not grant access to a restricted downstream service."
    ],
    "boundaries": {
      "sourceWasNotRefetchedAtRuntime": true,
      "cryptographicSignatureVerified": false,
      "accessAuthorityGranted": false
    },
    "receiptDigest": "11f7b212dc2b25048c5122bfc745bcd12f2172f71ae10457c5728142943418bd"
  },
  {
    "schema": "trusted-govuk-discovery.evidence-receipt.v1",
    "id": "trusted-govuk-discovery:evidence-receipt:sha256:8aa1d0338c08be66a20f7c09b1da96aeb2d2d370f04cab6f8b1800d72c66fcd3",
    "observedAt": "2026-08-29T14:55:00Z",
    "sourceLock": "curated-official-api-data-2026-08-29",
    "source": {
      "url": "https://www.api.gov.uk/gds/gov-uk-organisations/",
      "title": "GOV.UK Organisations — API Catalogue",
      "publisher": "Data Standards Authority",
      "sourceDigest": "c7b0c82c27cb34a684b200c7f3b372f95d870f5a38c710f9826404d1fb0f7967"
    },
    "output": {
      "recordId": "govuk-discovery:api:govuk-organisations",
      "recordDigest": "8aa1d0338c08be66a20f7c09b1da96aeb2d2d370f04cab6f8b1800d72c66fcd3",
      "bundleDigest": "20593105f6e34d5072f566b4f7b98cab143c4333c56bbabfca831b935237945c"
    },
    "assertionStatuses": [
      "official-source"
    ],
    "limitations": [
      "Public access was not established by this review.",
      "No open licence is inferred from catalogue inclusion.",
      "No endpoint is called by this prototype."
    ],
    "boundaries": {
      "sourceWasNotRefetchedAtRuntime": true,
      "cryptographicSignatureVerified": false,
      "accessAuthorityGranted": false
    },
    "receiptDigest": "2421390eb27267276dbe1000dddb8b04abc6187c508174193fd5c9cd1aa01625"
  },
  {
    "schema": "trusted-govuk-discovery.evidence-receipt.v1",
    "id": "trusted-govuk-discovery:evidence-receipt:sha256:1efb5f3637bd49b8c6e62612c1346ea53928401f2d456645bb25e226e5f6c2f3",
    "observedAt": "2026-08-29T14:55:00Z",
    "sourceLock": "curated-official-api-data-2026-08-29",
    "source": {
      "url": "https://www.api.gov.uk/gds/gov-uk-search/",
      "title": "GOV.UK Search — API Catalogue",
      "publisher": "Data Standards Authority",
      "sourceDigest": "9d7b13b0cdfada27164d8b108173a5899fd4acb7296a483c758c65bcd0421c63"
    },
    "output": {
      "recordId": "govuk-discovery:api:govuk-search",
      "recordDigest": "1efb5f3637bd49b8c6e62612c1346ea53928401f2d456645bb25e226e5f6c2f3",
      "bundleDigest": "20593105f6e34d5072f566b4f7b98cab143c4333c56bbabfca831b935237945c"
    },
    "assertionStatuses": [
      "official-source"
    ],
    "limitations": [
      "Public access was not established by this review.",
      "No open licence is inferred from catalogue inclusion.",
      "Search results may not cover the full GOV.UK estate."
    ],
    "boundaries": {
      "sourceWasNotRefetchedAtRuntime": true,
      "cryptographicSignatureVerified": false,
      "accessAuthorityGranted": false
    },
    "receiptDigest": "1f3ce03e11e63dc50d39e0e0578abaabd495338ef3dc7e3b26a9e9eb7385ce46"
  },
  {
    "schema": "trusted-govuk-discovery.evidence-receipt.v1",
    "id": "trusted-govuk-discovery:evidence-receipt:sha256:89273fc6af32497ae5bb14d07890431da7145831833232fb796024e591643bac",
    "observedAt": "2026-08-29T14:55:00Z",
    "sourceLock": "curated-official-api-data-2026-08-29",
    "source": {
      "url": "https://www.api.gov.uk/tna/discovery/",